"","x"
"1","Fabiano Flora: How this Portuguese coach sees hopes for Nepal football in little Kathmandu kids"
"2","Is Nepal prepared to save the grassroots population from another Covid-like outbreak in the future?"
"3","Redmi Note 12 5G in Nepal: Will it be the best budget phone of the year?"
"4","Victoria Nuland, high US official, visiting Nepal soon "
"5","7 things Nepal’s new foreign minister should prioritise "
"6","Haribol Gajurel is PM Dahal’s chief political advisor "
"7","Min Bahadur Shrestha appointed National Planning Commission vice-chairperson "
"8","‘Supreme Court will soon start an online case registration system’ "
"9","Narayangadh-Butwal road expansion: 23% of work done in 48 months "
"10","Pokhara plane crash: Bodies of 6 victims need DNA tests for identification "
"11","Bajura earthquake kills 1 "
"12","Manoj Pandey, beauty pageant host, convicted of human trafficking in 9-year-old rape case "
"13","Pokhara plane crash: Bodies of 6 victims need DNA tests for identification"
"14","Manoj Pandey, beauty pageant host, convicted of human trafficking in 9-year-old rape case"
"15","Prem Prasad Acharya: The man who put himself on fire after a depressing note is dead"
"16","Narayangadh-Butwal road expansion: 23% of work done in 48 months"
"17","Min Bahadur Shrestha appointed National Planning Commission vice-chairperson"
"18","Domestic airports in Nepal prove white elephants as politicians disregard prudent planning"
"19","Rasuwagadhi border closed for 2 weeks citing the Chinese New Year"
"20","Why Nepal needs to understand yoga isn’t meant for correcting your body image "
"21","Xiaomi Mi Smart air fryer 3.5L in Nepal: How can it make your life easier? "
"22","11 modern Nepali songs to include on your picnic playlist "
"23","Hera Bahadur Shakya: Meet the favourite daura-suruwal tailor of Nepali politicians "
"24","Bhairahawa airport shut for over a month citing bad weather "
"25","Domestic airports in Nepal prove white elephants as politicians disregard prudent planning "
"26","Pokhara plane crash defers Nepal’s hope of getting off EU air safety blacklist "
"27","Kathmandu-Beijing direct flights resume after 3 Covid years "
"28","Fabiano Flora: How this Portuguese coach sees hopes for Nepal football in little Kathmandu kids "
"29","Excited? Here are 5 major technological changes Nepal will see in 2023 "
"30","Why is Balen Shah running away from questions? "
"31","Artificial intelligence in Nepal: Amid growing use, here are the things you should know "
"32","Why is death by asphyxiation during winter more common in Nepal? "
"33","Ravi Bahadur Shakya: Nepal’s sculptor exemplifies how age-old craft prospers in the new era"
"34","90 saalko bhuilchalo: 6 key facts about the 1934 earthquake"
"35","Khichadi on Maghe Sankranti: Why and how"
"36","Chaku: Everything you need to know about the Maghe Sankranti delicacy"
"37","Magnitude 5.9 earthquake rocks far-west Nepal "
"38","Meteorologists forecast winter rainfall from Monday night "
"39","Plan to replace cooking gas with electricity in Singhadarbar fails "
"40","Zontes ZT 155-U1 in Nepal: Stylish Chinese adventure bike has car-like features to get you"
"41","Price list: 8 best budget cars in Nepal for 2023"
"42","Price list: 7 electric scooters under Rs 300,000 in Nepal for 2023"
"43","Yatri Motorcycles: What’s so special about the super-expensive made-in-Nepal bikes?"
"44","Science & Technology"
"45","Digital banking fraud is on the rise in Kathmandu: Police"
"46","Excited? Here are 5 major technological changes Nepal will see in 2023"
"47","Price list: 5 best business laptops in Nepal for 2023"
"48","Artificial intelligence in Nepal: Amid growing use, here are the things you should know"
"49","Our recommendation list of 5 best camera phones in Nepal for 2023"
"50","Why is death by asphyxiation during winter more common in Nepal?"
"51","India positive about letting Nepal sell electricity to Bangladesh"
"52","Indira Rana Magar elected House of Representatives deputy speaker"
"53","Why is Balen Shah running away from questions?"
"54","Dev Raj Ghimire of the UML elected House of Representatives speaker"
"55","Indira Rana Magar, Mukta Kumari Yadav contesting for House deputy speaker"
"56","7 things Nepal’s new foreign minister should prioritise"
"57","Nepal needs to change its understanding of menstruation. It should begin with debunking myths"
"58","Why Nepal needs to understand yoga isn’t meant for correcting your body image"
"59","Nepal T20 League spot-fixing: CIB says team owners are involved, will probe CAN officials too"
"60","Spot-fixing in Nepal T20 League: Former cricketer Mehboob Alam, all-rounder Adil Ansari arrested"
"61","Nepal T20 League: CIB confirms spot-fixing, suspects match-fixing too"
"62","CAN shortlists 5 for vacant head coach position"
"63","ICC Cricket World Cup League 2: Less than a month to start the game, Nepal team don’t have a coach "
"64","Nepal T20 League: Mired in controversy, how an ambitious project spoiled Nepal cricket’s global image"
"65","Will Sandeep Lamichhane be back on the pitch? CAN says it’s consulting experts"
"66","Antim Grahan: Nepal’s pioneering black metal band are back, better and more ambitious "
"67","10 young Nepali singers that you must listen to this year "
"68","Live streaming in Nepal: Here’s a 4-step guide for you to begin with "
